A1: TOTAL LEAGUE & NON-LEAGUE (Combined)
A2: GAA | C2: W | D2: L | E2: T | F2: MIN | G2: GA | H2: EN | I2: SAV | J2: SHO | K2: PCT | L2: GP
A3: =60/+F3*+G3 -> 6.000 | B3: Dan Callaghan | C3: 1 | D3: 1 | E3: 0 | F3: 160 | G3: 16 | H3: 0 | I3: 85 | J3: 101 | K3: =I3/+J3 -> 0.84158415841584155 | L3: 8
A4: =60/+F4*+G4 -> 6.666666666666667 | B4: Dan Jenney | C4: 0 | D4: 0 | E4: 0 | F4: 144 | G4: 16 | H4: 0 | I4: 88 | J4: 104 | K4: =I4/+J4 -> 0.84615384615384615 | L4: 7
A5: =60/+F5*+G5 -> 3.7922077922077926 | B5: Joe Wichowski | C5: 15 | D5: 6 | E5: 2 | F5: 1155 | G5: 73 | H5: 2 | I5: 593 | J5: 666 | K5: =I5/+J5 -> 0.89039039039039036 | L5: 23
A6: =60/+F6*+G6 -> 4.3180260452364632 | B6: FORDHAM | C6: =SUM(C3:C5) -> 16 | D6: =SUM(D3:D5) -> 7 | E6: =SUM(E3:E5) -> 2 | F6: =SUM(F3:F5) -> 1459 | G6: =SUM(G3:G5) -> 105 | H6: =SUM(H3:H5) -> 2 | I6: =SUM(I3:I5) -> 766 | J6: =SUM(J3:J5) -> 871 | K6: =I6/+J6 -> 0.87944890929965558 | L6: 25
A7: =60/+F7*+G7 -> 5.604395604395604 | B7: OPPONENT | C7: 7 | D7: 16 | E7: 2 | F7: 1456 | G7: 136 | H7: 1 | I7: 835 | J7: 971 | K7: =I7/+J7 -> 0.85993820803295573 | L7: 25
A9: TOTAL LEAGUE
A10: GAA | C10: W | D10: L | E10: T | F10: MIN | G10: GA | H10: EN | I10: SAV | J10: SHO | K10: PCT | L10: GP
A11: =60/+F11*+G11 -> 4.8648648648648649 | B11: Dan Callaghan | C11: 1 | D11: 0 | E11: 0 | F11: 37 | G11: 3 | H11: 0 | I11: 11 | J11: 14 | K11: =I11/+J11 -> 0.7857142857142857 | L11: 3
A12: =60/+F12*+G12 -> 7.2727272727272725 | B12: Dan Jenney | C12: 0 | D12: 0 | E12: 0 | F12: 66 | G12: 8 | H12: 0 | I12: 53 | J12: 61 | K12: =I12/+J12 -> 0.86885245901639341 | L12: 4
A13: =60/+F13*+G13 -> 3.9608801955990223 | B13: Joe Wichowski | C13: 8 | D13: 5 | E13: 2 | F13: 818 | G13: 54 | H13: 1 | I13: 406 | J13: 460 | K13: =I13/+J13 -> 0.88260869565217392 | L13: 15
A14: =60/+F14*+G14 -> 4.234527687296417 | B14: FORDHAM | C14: =SUM(C11:C13) -> 9 | D14: =SUM(D11:D13) -> 5 | E14: =SUM(E11:E13) -> 2 | F14: =SUM(F11:F13) -> 921 | G14: =SUM(G11:G13) -> 65 | H14: =SUM(H11:H13) -> 1 | I14: =SUM(I11:I13) -> 470 | J14: =SUM(J11:J13) -> 535 | K14: =I14/+J14 -> 0.87850467289719625 | L14: 15
A15: =60/+F15*+G15 -> 5.2173913043478262 | B15: OPPONENT | C15: 5 | D15: 9 | E15: 2 | F15: 920 | G15: 80 | H15: 0 | I15: 555 | J15: 635 | K15: =I15/+J15 -> 0.87401574803149606 | L15: 15
A17: TOTAL NON-LEAGUE
A18: GAA | C18: W | D18: L | E18: T | F18: MIN | G18: GA | H18: EN | I18: SAV | J18: SHO | K18: PCT | L18: GP
A19: =60/+F19*+G19 -> 6.3414634146341466 | B19: Dan Callaghan | C19: 0 | D19: 1 | E19: 0 | F19: 123 | G19: 13 | H19: 0 | I19: =15+6+20+18+15 -> 74 | J19: =22+24+22+19 -> 87 | K19: =I19/+J19 -> 0.85057471264367812 | L19: 5
A20: =60/+F20*+G20 -> 6.1538461538461542 | B20: Dan Jenney | C20: 0 | D20: 0 | E20: 0 | F20: 78 | G20: 8 | H20: 0 | I20: =9+17+9 -> 35 | J20: =12+20+11 -> 43 | K20: =I20/+J20 -> 0.81395348837209303 | L20: 3
A21: =60/+F21*+G21 -> 3.3827893175074188 | B21: Joe Wichowski | C21: 7 | D21: 1 | E21: 0 | F21: =199+20+60+58 -> 337 | G21: 19 | H21: 1 | I21: =31+12+32+14+12+14+31+41 -> 187 | J21: =34+14+35+15+12+16+34+46 -> 206 | K21: =I21/+J21 -> 0.90776699029126218 | L21: 8
A22: =60/+F22*+G22 -> 4.4609665427509295 | B22: FORDHAM | C22: =SUM(C19:C21) -> 7 | D22: =SUM(D19:D21) -> 2 | E22: =SUM(E19:E21) -> 0 | F22: =SUM(F19:F21) -> 538 | G22: =SUM(G19:G21) -> 40 | H22: =SUM(H19:H21) -> 1 | I22: =SUM(I19:I21) -> 296 | J22: =SUM(J19:J21) -> 336 | K22: =I22/+J22 -> 0.88095238095238093 | L22: 9
A23: =60/+F23*+G23 -> 6.2686567164179108 | B23: OPPONENT | C23: 2 | D23: 7 | E23: 0 | F23: =357+59+60+60 -> 536 | G23: 56 | H23: 1 | I23: =39+42+34+30+21+7+9+18+18+32+30 -> 280 | J23: =43+47+37+36+23+5+10+13+22+28+39+33 -> 336 | K23: =I23/+J23 -> 0.83333333333333337 | L23: 9