A1: TOTAL LEAGUE & NON-LEAGUE (Combined)
A2: PLAYER | B2: G | C2: A | D2: PTS | E2: PP | F2: SH | G2: GW | H2: PIM | I2: GP
A3: Matt Pangia | B3: 27 | C3: 22 | D3: 49 | E3: 5 | F3: 3 | G3: 4 | H3: 4 | I3: 25
A4: Dave Improta | B4: 24 | C4: 18 | D4: 42 | E4: 2 | F4: 1 | G4: 4 | H4: 42 | I4: 24
A5: John Stachulski | B5: 21 | C5: 21 | D5: 42 | E5: 5 | F5: 1 | G5: 3 | H5: 0 | I5: 25
A6: Rich Siemion | B6: 12 | C6: 24 | D6: 36 | E6: 4 | F6: 1 | G6: 1 | H6: 8 | I6: 25
A7: Steve Casey | B7: 16 | C7: 16 | D7: 32 | E7: 3 | F7: 2 | G7: 0 | H7: 42 | I7: 23
A8: Jim Bertorelli | B8: 8 | C8: 16 | D8: 24 | E8: 2 | F8: 0 | G8: 1 | H8: 40 | I8: 21
A9: Colin Downey | B9: 6 | C9: 8 | D9: 14 | E9: 2 | F9: 1 | G9: 1 | H9: 10 | I9: 16
A10: Matt Hogan | B10: 5 | C10: 8 | D10: 13 | E10: 0 | F10: 0 | G10: 0 | H10: 6 | I10: 25
A11: Mike Connolly | B11: 3 | C11: 8 | D11: 11 | E11: 0 | F11: 0 | G11: 0 | H11: 20 | I11: 25
A12: John Rutter | B12: 2 | C12: 7 | D12: 9 | E12: 0 | F12: 0 | G12: 0 | H12: 73 | I12: 25
A13: Derek Kennedy | B13: 5 | C13: 3 | D13: 8 | E13: 0 | F13: 0 | G13: 0 | H13: 14 | I13: 15
A14: Mike Masefield | B14: 2 | C14: 5 | D14: 7 | E14: 0 | F14: 0 | G14: 1 | H14: 10 | I14: 16
A15: Pat Kelley | B15: 2 | C15: 3 | D15: 5 | E15: 0 | F15: 0 | G15: 0 | H15: 6 | I15: 21
A16: Tom Scagnelli | B16: 1 | C16: 4 | D16: 5 | E16: 0 | F16: 0 | G16: 0 | H16: 4 | I16: 23
A17: Ian O'Reilly | B17: 1 | C17: 3 | D17: 4 | E17: 1 | F17: 0 | G17: 1 | H17: 24 | I17: 21
A18: Geoff Rixon | B18: 1 | C18: 2 | D18: 3 | E18: 0 | F18: 0 | G18: 0 | H18: 2 | I18: 21
A19: Mike Mahoney | B19: 1 | C19: 2 | D19: 3 | E19: 0 | F19: 0 | G19: 0 | H19: 0 | I19: 4
A20: Mike Daw | B20: 0 | C20: 2 | D20: 2 | E20: 0 | F20: 0 | G20: 0 | H20: 22 | I20: 25
A21: Pete Puglisi | B21: 0 | C21: 2 | D21: 2 | E21: 0 | F21: 0 | G21: 0 | H21: 4 | I21: 20
A22: Mike Hearon | B22: 0 | C22: 0 | D22: 0 | E22: 0 | F22: 0 | G22: 0 | H22: 12 | I22: 17
A23: Dan Callaghan | B23: 0 | C23: 0 | D23: 0 | E23: 0 | F23: 0 | G23: 0 | H23: 5 | I23: 8
A24: Bench | B24: 0 | C24: 0 | D24: 0 | E24: 0 | F24: 0 | G24: 0 | H24: 4 | I24: 25
A25: Pat Macoy | B25: 0 | C25: 0 | D25: 0 | E25: 0 | F25: 0 | G25: 0 | H25: 2 | I25: 22
A26: Joe Wichowski | B26: 0 | C26: 0 | D26: 0 | E26: 0 | F26: 0 | G26: 0 | H26: 0 | I26: 23
A27: Dan Jenney | B27: 0 | C27: 0 | D27: 0 | E27: 0 | F27: 0 | G27: 0 | H27: 0 | I27: 7
A28: FORDHAM | B28: =SUM(B3:B27) -> 137 | C28: =SUM(C3:C27) -> 174 | D28: =SUM(D3:D27) -> 311 | E28: =SUM(E3:E27) -> 24 | F28: =SUM(F3:F27) -> 9 | G28: =SUM(G3:G27) -> 16 | H28: =SUM(H3:H27) -> 354 | I28: 25
A29: OPPONENT | B29: 107 | C29: 145 | D29: =C29+B29 -> 252 | E29: 19 | F29: 4 | G29: 7 | H29: 326 | I29: 25
A31: TOTAL LEAGUE
A32: PLAYER | B32: G | C32: A | D32: PTS | E32: PP | F32: SH | G32: GW | H32: PIM | I32: GP
A33: Matt Pangia | B33: 11 | C33: 16 | D33: =SUM(B33:C33) -> 27 | E33: 3 | F33: 1 | G33: 0 | H33: 4 | I33: 16
A34: Dave Improta | B34: 16 | C34: 11 | D34: =SUM(B34:C34) -> 27 | E34: 2 | F34: 0 | G34: 3 | H34: 20 | I34: 15
A35: John Stachulski | B35: 14 | C35: 11 | D35: =SUM(B35:C35) -> 25 | E35: 2 | F35: 1 | G35: 2 | H35: 0 | I35: 16
A36: Rich Siemion | B36: 9 | C36: 13 | D36: =SUM(B36:C36) -> 22 | E36: 3 | F36: 1 | G36: 1 | H36: 2 | I36: 16
A37: Steve Casey | B37: 9 | C37: 14 | D37: =SUM(B37:C37) -> 23 | E37: 2 | F37: 1 | G37: 0 | H37: 26 | I37: 15
A38: Jim Bertorelli | B38: 5 | C38: 9 | D38: =SUM(B38:C38) -> 14 | E38: 1 | F38: 0 | G38: 1 | H38: 26 | I38: 13
A39: Colin Downey | B39: 3 | C39: 4 | D39: =SUM(B39:C39) -> 7 | E39: 1 | F39: 1 | G39: 1 | H39: 6 | I39: 10
A40: Matt Hogan | B40: 2 | C40: 4 | D40: =SUM(B40:C40) -> 6 | E40: 0 | F40: 0 | G40: 0 | H40: 4 | I40: 16
A41: Mike Connolly | B41: 2 | C41: 7 | D41: =SUM(B41:C41) -> 9 | E41: 0 | F41: 0 | G41: 0 | H41: 12 | I41: 16
A42: John Rutter | B42: 1 | C42: 1 | D42: =SUM(B42:C42) -> 2 | E42: 0 | F42: 0 | G42: 0 | H42: 40 | I42: 16
A43: Derek Kennedy | B43: 2 | C43: 2 | D43: =SUM(B43:C43) -> 4 | E43: 0 | F43: 0 | G43: 0 | H43: 4 | I43: 9
A44: Mike Masefield | B44: 0 | C44: 2 | D44: =SUM(B44:C44) -> 2 | E44: 0 | F44: 0 | G44: 0 | H44: 4 | I44: 8
A45: Pat Kelley | B45: 2 | C45: 1 | D45: =SUM(B45:C45) -> 3 | E45: 0 | F45: 0 | G45: 0 | H45: 4 | I45: 13
A46: Tom Scagnelli | B46: 1 | C46: 3 | D46: =SUM(B46:C46) -> 4 | E46: 0 | F46: 0 | G46: 0 | H46: 2 | I46: 14
A47: Ian O'Reilly | B47: 1 | C47: 3 | D47: =SUM(B47:C47) -> 4 | E47: 1 | F47: 0 | G47: 1 | H47: 18 | I47: 15
A48: Geoff Rixon | B48: 1 | C48: 2 | D48: =SUM(B48:C48) -> 3 | E48: 0 | F48: 0 | G48: 0 | H48: 0 | I48: 13
A49: Mike Mahoney | B49: 1 | C49: 1 | D49: =SUM(B49:C49) -> 2 | E49: 0 | F49: 0 | G49: 0 | H49: 0 | I49: 2
A50: Mike Daw | B50: 0 | C50: 1 | D50: =SUM(B50:C50) -> 1 | E50: 0 | F50: 0 | G50: 0 | H50: 16 | I50: 16
A51: Pete Puglisi | B51: 0 | C51: 2 | D51: =SUM(B51:C51) -> 2 | E51: 0 | F51: 0 | G51: 0 | H51: 2 | I51: 13
A52: Mike Hearon | B52: 0 | C52: 0 | D52: =SUM(B52:C52) -> 0 | E52: 0 | F52: 0 | G52: 0 | H52: 6 | I52: 9
A53: Dan Callaghan | B53: 0 | C53: 0 | D53: =SUM(B53:C53) -> 0 | E53: 0 | F53: 0 | G53: 0 | H53: 5 | I53: 3
A54: Bench | B54: 0 | C54: 0 | D54: =SUM(B54:C54) -> 0 | E54: 0 | F54: 0 | G54: 0 | H54: 4 | I54: 16
A55: Pat Macoy | B55: 0 | C55: 0 | D55: =SUM(B55:C55) -> 0 | E55: 0 | F55: 0 | G55: 0 | H55: 0 | I55: 13
A56: Joe Wichowski | B56: 0 | C56: 0 | D56: =SUM(B56:C56) -> 0 | E56: 0 | F56: 0 | G56: 0 | H56: 0 | I56: 15
A57: Dan Jenney | B57: 0 | C57: 0 | D57: =SUM(B57:C57) -> 0 | E57: 0 | F57: 0 | G57: 0 | H57: 0 | I57: 4
A58: FORDHAM | B58: =SUM(B33:B57) -> 80 | C58: =SUM(C33:C57) -> 107 | D58: =SUM(D33:D57) -> 187 | E58: =SUM(E33:E57) -> 15 | F58: =SUM(F33:F57) -> 5 | G58: =SUM(G33:G57) -> 9 | H58: =SUM(H33:H57) -> 205 | I58: 16
A59: OPPONENT | B59: 66 | C59: 90 | D59: =+C63+B63 -> 22 | E59: 14 | F59: 4 | G59: 5 | H59: 222 | I59: 16
A61: TOTAL NON-LEAGUE
A62: PLAYER | B62: G | C62: A | D62: PTS | E62: PP | F62: SH | G62: GW | H62: PIM | I62: GP
A63: Matt Pangia | B63: 16 | C63: 6 | D63: =SUM(B63:C63) -> 22 | E63: 2 | F63: 2 | G63: 4 | H63: 0 | I63: 9
A64: Dave Improta | B64: 8 | C64: 7 | D64: =SUM(B64:C64) -> 15 | E64: 0 | F64: 1 | G64: 1 | H64: 22 | I64: 9
A65: John Stachulski | B65: 7 | C65: 10 | D65: =SUM(B65:C65) -> 17 | E65: 3 | F65: 0 | G65: 1 | H65: 0 | I65: 9
A66: Rich Siemion | B66: 3 | C66: 11 | D66: =SUM(B66:C66) -> 14 | E66: 1 | F66: 0 | G66: 0 | H66: 6 | I66: 9
A67: Steve Casey | B67: 7 | C67: 2 | D67: =SUM(B67:C67) -> 9 | E67: 1 | F67: 1 | G67: 0 | H67: 16 | I67: 8
A68: Jim Bertorelli | B68: 3 | C68: 7 | D68: =SUM(B68:C68) -> 10 | E68: 1 | F68: 0 | G68: 0 | H68: 14 | I68: 8
A69: Colin Downey | B69: 3 | C69: 4 | D69: =SUM(B69:C69) -> 7 | E69: 1 | F69: 0 | G69: 0 | H69: 4 | I69: 6
A70: Matt Hogan | B70: 3 | C70: 4 | D70: =SUM(B70:C70) -> 7 | E70: 0 | F70: 0 | G70: 0 | H70: 2 | I70: 9
A71: Mike Connolly | B71: 1 | C71: 1 | D71: =SUM(B71:C71) -> 2 | E71: 0 | F71: 0 | G71: 0 | H71: 8 | I71: 9
A72: John Rutter | B72: 1 | C72: 6 | D72: =SUM(B72:C72) -> 7 | E72: 0 | F72: 0 | G72: 0 | H72: 33 | I72: 9
A73: Derek Kennedy | B73: 3 | C73: 1 | D73: =SUM(B73:C73) -> 4 | E73: 0 | F73: 0 | G73: 0 | H73: 10 | I73: 6
A74: Mike Masefield | B74: 2 | C74: 3 | D74: =SUM(B74:C74) -> 5 | E74: 0 | F74: 0 | G74: 1 | H74: 6 | I74: 8
A75: Pat Kelley | B75: 0 | C75: 2 | D75: =SUM(B75:C75) -> 2 | E75: 0 | F75: 0 | G75: 0 | H75: 2 | I75: 8
A76: Tom Scagnelli | B76: 0 | C76: 1 | D76: =SUM(B76:C76) -> 1 | E76: 0 | F76: 0 | G76: 0 | H76: 2 | I76: 9
A77: Ian O'Reilly | B77: 0 | C77: 0 | D77: =SUM(B77:C77) -> 0 | E77: 0 | F77: 0 | G77: 0 | H77: 6 | I77: 6
A78: Geoff Rixon | B78: 0 | C78: 0 | D78: =SUM(B78:C78) -> 0 | E78: 0 | F78: 0 | G78: 0 | H78: 2 | I78: 8
A79: Mike Mahoney | B79: 0 | C79: 1 | D79: =SUM(B79:C79) -> 1 | E79: 0 | F79: 0 | G79: 0 | H79: 0 | I79: 2
A80: Mike Daw | B80: 0 | C80: 1 | D80: =SUM(B80:C80) -> 1 | E80: 0 | F80: 0 | G80: 0 | H80: 6 | I80: 9
A81: Pete Puglisi | B81: 0 | C81: 0 | D81: =SUM(B81:C81) -> 0 | E81: 0 | F81: 0 | G81: 0 | H81: 2 | I81: 7
A82: Mike Hearon | B82: 0 | C82: 0 | D82: =SUM(B82:C82) -> 0 | E82: 0 | F82: 0 | G82: 0 | H82: 6 | I82: 8
A83: Dan Callaghan | B83: 0 | C83: 0 | D83: =SUM(B83:C83) -> 0 | E83: 0 | F83: 0 | G83: 0 | H83: 0 | I83: 5
A84: Bench | B84: 0 | C84: 0 | D84: =SUM(B84:C84) -> 0 | E84: 0 | F84: 0 | G84: 0 | H84: 0 | I84: 9
A85: Pat Macoy | B85: 0 | C85: 0 | D85: =SUM(B85:C85) -> 0 | E85: 0 | F85: 0 | G85: 0 | H85: 2 | I85: 9
A86: Joe Wichowski | B86: 0 | C86: 0 | D86: =SUM(B86:C86) -> 0 | E86: 0 | F86: 0 | G86: 0 | H86: 0 | I86: 8
A87: Dan Jenney | B87: 0 | C87: 0 | D87: =SUM(B87:C87) -> 0 | E87: 0 | F87: 0 | G87: 0 | H87: 0 | I87: 3
A88: FORDHAM | B88: =SUM(B63:B87) -> 57 | C88: =SUM(C63:C87) -> 67 | D88: =SUM(D63:D87) -> 124 | E88: =SUM(E63:E87) -> 9 | F88: =SUM(F63:F87) -> 4 | G88: =SUM(G63:G87) -> 7 | H88: =SUM(H63:H87) -> 149 | I88: 9
A89: OPPONENT | B89: 41 | C89: 55 | D89: =+C89+B89 -> 96 | E89: 5 | F89: 0 | G89: 2 | H89: =92+12 -> 104 | I89: 9