A1: TOTAL LEAGUE & NON-LEAGUE (Combined)
A2: FORDHAM | B2: 24 | C2: - | D2: 105 | E2: =(B2/D2) -> 0.22857142857142856
A3: OPPONENT | B3: 19 | C3: - | D3: 125 | E3: =(B3/D3) -> 0.152
A5: TOTAL LEAGUE
A6: FORDHAM | B6: 15 | C6: - | D6: 71 | E6: =(B6/D6) -> 0.21126760563380281
A7: OPPONENT | B7: 14 | C7: - | D7: 75 | E7: =(B7/D7) -> 0.18666666666666668
A9: TOTAL NON-LEAGUE
A10: FORDHAM | B10: 9 | C10: - | D10: 34 | E10: =(B10/D10) -> 0.26470588235294118
A11: OPPONENT | B11: 5 | C11: - | D11: 50 | E11: =(B11/D11) -> 0.1