A1: TOTAL LEAGUE & NON-LEAGUE (Combined)
A2: GAA | C2: W | D2: L | E2: T | F2: MIN | G2: GA | H2: EN | I2: SAV | J2: SHO | K2: PCT | L2: GP
A3: =60/+F3*+G3 -> 2.7272727272727271 | B3: DanCallaghan | C3: 0 | D3: 1 | E3: 0 | F3: 132 | G3: 6 | H3: 1 | I3: 51 | J3: 57 | K3: 0.89473684210526316 | L3: 7
A4: =60/+F4*+G4 -> 1.0909090909090908 | B4: GregSiroky | C4: 2 | D4: 0 | E4: 0 | F4: 165 | G4: 3 | H4: 0 | I4: 72 | J4: 75 | K4: 0.96 | L4: 6
A5: =60/+F5*+G5 -> 2.0477815699658701 | B5: JoeWichowski | C5: 19 | D5: 3 | E5: 0 | F5: 1172 | G5: 40 | H5: 0 | I5: 524 | J5: 566 | K5: 0.9257950530035336 | L5: 23
A6: =60/+F6*+G6 -> 2.0013614703880194 | B6: FORDHAM | C6: =SUM(C3:C5) -> 21 | D6: =SUM(D3:D5) -> 4 | E6: =SUM(E3:E5) -> 0 | F6: 1469 | G6: =SUM(G3:G5) -> 49 | H6: =SUM(H3:H5) -> 1 | I6: =SUM(I3:I5) -> 647 | J6: =SUM(J3:J5) -> 698 | K6: =I6/+J6 -> 0.92693409742120347 | L6: 25
A7: 5.6557377049180326 | B7: OPPONENT | C7: 4 | D7: 21 | E7: 0 | F7: 1464 | G7: 138 | H7: 2 | I7: 742 | J7: 880 | K7: 0.84318181818181814 | L7: 25
A9: TOTAL LEAGUE
A10: GAA | C10: W | D10: L | E10: T | F10: MIN | G10: GA | H10: EN | I10: SAV | J10: SHO | K10: PCT | L10: GP
A11: =60/+F11*+G11 -> 3.00 | B11: DanCallaghan | C11: 0 | D11: 0 | E11: 0 | F11: 20 | G11: 1 | H11: 0 | I11: 8 | J11: 9 | K11: =I11/+J11 -> 0.88888888888888884 | L11: 1
A12: =60/+F12*+G12 -> 1.00 | B12: GregSiroky | C12: 1 | D12: 0 | E12: 0 | F12: 60 | G12: 1 | H12: 0 | I12: 20 | J12: 21 | K12: =I12/+J12 -> 0.95238095238095233 | L12: 1
A13: =60/+F13*+G13 -> 1.9649122807017543 | B13: JoeWichowski | C13: 13 | D13: 2 | E13: 0 | F13: =515+60+60+60+60+60+40 -> 855 | G13: 28 | H13: 0 | I13: =31+48+17+23+24+13+22+17+26+23+20+25+25+35+29 -> 378 | J13: =32+50+17+25+27+13+26+17+28+27+21+26+25+39+33 -> 406 | K13: =I13/+J13 -> 0.93103448275862066 | L13: 15
A14: =60/+F14*+G14 -> 1.9251336898395723 | B14: FORDHAM | C14: =SUM(C11:C13) -> 14 | D14: =SUM(D11:D13) -> 2 | E14: =SUM(E11:E13) -> 0 | F14: =SUM(F11:F13) -> 935 | G14: =SUM(G11:G13) -> 30 | H14: =SUM(H11:H13) -> 0 | I14: =SUM(I11:I13) -> 406 | J14: =SUM(J11:J13) -> 436 | K14: =I14/+J14 -> 0.93119266055045868 | L14: 16
A15: 5.806451612903226 | B15: OPPONENT | C15: 2 | D15: 14 | E15: 0 | F15: 930 | G15: 90 | H15: 1 | I15: 500 | J15: 590 | K15: 0.84745762711864403 | L15: 16
A17: TOTAL NON-LEAGUE/PLAYOFFS
A18: GAA | C18: W | D18: L | E18: T | F18: MIN | G18: GA | H18: EN | I18: SAV | J18: SHO | K18: PCT | L18: GP
A19: =60/+F19*+G19 -> 2.6785714285714284 | B19: DanCallaghan | C19: 0 | D19: 1 | E19: 0 | F19: =93+19 -> 112 | G19: 5 | H19: 1 | I19: =10+14+9+10 -> 43 | J19: =11+16+10+11 -> 48 | K19: =I19/+J19 -> 0.89583333333333337 | L19: 6
A20: =60/+F20*+G20 -> 1.1428571428571428 | B20: =+B12 -> GregSiroky | C20: 1 | D20: 0 | E20: 0 | F20: =85+20 -> 105 | G20: 2 | H20: 0 | I20: =29+23 -> 52 | J20: =31+23 -> 54 | K20: =I20/+J20 -> 0.96296296296296291 | L20: 5
A21: =60/+F21*+G21 -> 2.2712933753943219 | B21: JoeWichowski | C21: 6 | D21: 1 | E21: 0 | F21: =110+20+60+60+67 -> 317 | G21: 12 | H21: 0 | I21: =13+15+7+13+28+36+34 -> 146 | J21: =38+14+29+43+36 -> 160 | K21: =I21/+J21 -> 0.91249999999999998 | L21: 8
A22: =60/+F22*+G22 -> 2.1348314606741572 | B22: FORDHAM | C22: =SUM(C19:C21) -> 7 | D22: =SUM(D19:D21) -> 2 | E22: =SUM(E19:E21) -> 0 | F22: =SUM(F19:F21) -> 534 | G22: =SUM(G19:G21) -> 19 | H22: =SUM(H19:H21) -> 1 | I22: =SUM(I19:I21) -> 241 | J22: =SUM(J19:J21) -> 262 | K22: =I22/+J22 -> 0.91984732824427484 | L22: 9
A23: 5.393258426966292 | B23: OPPONENT | C23: 2 | D23: 7 | E23: 0 | F23: 534 | G23: 48 | H23: 1 | I23: 242 | J23: 290 | K23: 0.83448275862068966 | L23: 9