A1: TOTAL LEAGUE & NON-LEAGUE (Combined)
A2: PLAYER | B2: G | C2: A | D2: PTS | E2: PP | F2: SH | G2: GW | H2: PIM | I2: GP
A3: Jorge Rocha | B3: 23 | C3: 18 | D3: 41 | E3: 2 | F3: 1 | G3: 5 | H3: 50 | I3: 25
A4: Matt Pangia | B4: 21 | C4: 15 | D4: 36 | E4: 5 | F4: 0 | G4: 1 | H4: 4 | I4: 24
A5: Stephen Barrett | B5: 20 | C5: 9 | D5: 29 | E5: 4 | F5: 0 | G5: 4 | H5: 4 | I5: 25
A6: John Stachulski | B6: 13 | C6: 14 | D6: 27 | E6: 2 | F6: 2 | G6: 0 | H6: 6 | I6: 16
A7: John Gibbons | B7: 9 | C7: 14 | D7: 23 | E7: 2 | F7: 0 | G7: 2 | H7: 24 | I7: 23
A8: Dave Improta | B8: 7 | C8: 13 | D8: 20 | E8: 2 | F8: 1 | G8: 3 | H8: 32 | I8: 23
A9: Jim Bertorelli | B9: 10 | C9: 8 | D9: 18 | E9: 0 | F9: 0 | G9: 0 | H9: 42 | I9: 24
A10: John Rutter | B10: 2 | C10: 16 | D10: 18 | E10: 1 | F10: 0 | G10: 0 | H10: 24 | I10: 25
A11: Mike Connolly | B11: 4 | C11: 12 | D11: 16 | E11: 3 | F11: 0 | G11: 1 | H11: 14 | I11: 25
A12: Colin Downey | B12: 4 | C12: 9 | D12: 13 | E12: 2 | F12: 1 | G12: 1 | H12: 14 | I12: 18
A13: Steve Casey | B13: 7 | C13: 4 | D13: 11 | E13: 2 | F13: 0 | G13: 2 | H13: 20 | I13: 12
A14: Mike Winton | B14: 1 | C14: 8 | D14: 9 | E14: 0 | F14: 0 | G14: 0 | H14: 34 | I14: 23
A15: Dan Ferraro | B15: 3 | C15: 5 | D15: 8 | E15: 0 | F15: 0 | G15: 0 | H15: 8 | I15: 16
A16: Mike Lynch | B16: 4 | C16: 4 | D16: 8 | E16: 1 | F16: 0 | G16: 1 | H16: 10 | I16: 14
A17: James Reilly | B17: 0 | C17: 6 | D17: 6 | E17: 0 | F17: 0 | G17: 0 | H17: 4 | I17: 21
A18: Derek Kennedy | B18: 5 | C18: 1 | D18: 6 | E18: 0 | F18: 0 | G18: 1 | H18: 6 | I18: 22
A19: Ian O'Reilly | B19: 1 | C19: 4 | D19: 5 | E19: 0 | F19: 0 | G19: 0 | H19: 16 | I19: 18
A20: Mike Masefield | B20: 3 | C20: 2 | D20: 5 | E20: 0 | F20: 0 | G20: 0 | H20: 16 | I20: 23
A21: Pat Muse | B21: 0 | C21: 4 | D21: 4 | E21: 0 | F21: 0 | G21: 0 | H21: 4 | I21: 9
A22: Pete Puglisi | B22: 2 | C22: 0 | D22: 2 | E22: 0 | F22: 1 | G22: 0 | H22: 2 | I22: 12
A23: Mike Hearon | B23: 0 | C23: 1 | D23: 1 | E23: 0 | F23: 0 | G23: 0 | H23: 4 | I23: 13
A24: John Colussi | B24: 1 | C24: 0 | D24: 1 | E24: 0 | F24: 0 | G24: 0 | H24: 2 | I24: 11
A25: Tom Scagnelli | B25: 0 | C25: 0 | D25: 0 | E25: 0 | F25: 0 | G25: 0 | H25: 6 | I25: 24
A26: Dan Callaghan | B26: 0 | C26: 0 | D26: 0 | E26: 0 | F26: 0 | G26: 0 | H26: 0 | I26: 7
A27: Bench | B27: 0 | C27: 0 | D27: 0 | E27: 0 | F27: 0 | G27: 0 | H27: 4 | I27: 24
A28: Joe Wichowski | B28: 0 | C28: 0 | D28: 0 | E28: 0 | F28: 0 | G28: 0 | H28: 0 | I28: 23
A29: Greg Siroky | B29: 0 | C29: 0 | D29: 0 | E29: 0 | F29: 0 | G29: 0 | H29: 0 | I29: 6
A30: FORDHAM | B30: =SUM(B3:B29) -> 140 | C30: =SUM(C3:C29) -> 167 | D30: =SUM(D3:D29) -> 307 | E30: =SUM(E3:E29) -> 26 | F30: =SUM(F3:F29) -> 6 | G30: =SUM(G3:G29) -> 21 | H30: =SUM(H3:H29) -> 350 | I30: 25
A31: OPPONENT | B31: 50 | C31: 64 | D31: 114 | E31: 10 | F31: 3 | G31: 4 | H31: 319 | I31: 25
A33: TOTAL LEAGUE
A34: PLAYER | B34: G | C34: A | D34: PTS | E34: PP | F34: SH | G34: GW | H34: PIM | I34: GP
A35: Jorge Rocha | B35: 15 | C35: 9 | D35: =SUM(B35:C35) -> 24 | E35: 1 | F35: 1 | G35: 4 | H35: 24 | I35: 16
A36: Matt Pangia | B36: 11 | C36: 13 | D36: =SUM(B36:C36) -> 24 | E36: 2 | F36: 0 | G36: 1 | H36: 4 | I36: 16
A37: Stephen Barrett | B37: 13 | C37: 4 | D37: =SUM(B37:C37) -> 17 | E37: 3 | F37: 0 | G37: 1 | H37: 2 | I37: 16
A38: John Stachulski | B38: 9 | C38: 11 | D38: =SUM(B38:C38) -> 20 | E38: 2 | F38: 2 | G38: 0 | H38: 6 | I38: 13
A39: John Gibbons | B39: 4 | C39: 11 | D39: =SUM(B39:C39) -> 15 | E39: 1 | F39: 0 | G39: 1 | H39: 14 | I39: 14
A40: Dave Improta | B40: 4 | C40: 7 | D40: =SUM(B40:C40) -> 11 | E40: 1 | F40: 0 | G40: 2 | H40: 24 | I40: 15
A41: Jim Bertorelli | B41: 7 | C41: 4 | D41: =SUM(B41:C41) -> 11 | E41: 0 | F41: 0 | G41: 0 | H41: 26 | I41: 16
A42: John Rutter | B42: 1 | C42: 10 | D42: =SUM(B42:C42) -> 11 | E42: 0 | F42: 0 | G42: 0 | H42: 18 | I42: 16
A43: Mike Connolly | B43: 4 | C43: 6 | D43: =SUM(B43:C43) -> 10 | E43: 3 | F43: 0 | G43: 1 | H43: 8 | I43: 16
A44: Colin Downey | B44: 4 | C44: 8 | D44: =SUM(B44:C44) -> 12 | E44: 2 | F44: 1 | G44: 1 | H44: 8 | I44: 12
A45: Steve Casey | B45: 6 | C45: 4 | D45: =SUM(B45:C45) -> 10 | E45: 1 | F45: 0 | G45: 2 | H45: 16 | I45: 9
A46: Mike Winton | B46: 1 | C46: 3 | D46: =SUM(B46:C46) -> 4 | E46: 0 | F46: 0 | G46: 0 | H46: 22 | I46: 15
A47: Dan Ferraro | B47: 3 | C47: 4 | D47: =SUM(B47:C47) -> 7 | E47: 0 | F47: 0 | G47: 0 | H47: 8 | I47: 12
A48: Mike Lynch | B48: 2 | C48: 3 | D48: =SUM(B48:C48) -> 5 | E48: 1 | F48: 0 | G48: 0 | H48: 10 | I48: 10
A49: James Reilly | B49: 0 | C49: 5 | D49: =SUM(B49:C49) -> 5 | E49: 0 | F49: 0 | G49: 0 | H49: 2 | I49: 12
A50: Derek Kennedy | B50: 3 | C50: 1 | D50: =SUM(B50:C50) -> 4 | E50: 0 | F50: 0 | G50: 1 | H50: 4 | I50: 15
A51: Ian O'Reilly | B51: 1 | C51: 2 | D51: =SUM(B51:C51) -> 3 | E51: 0 | F51: 0 | G51: 0 | H51: 8 | I51: 10
A52: Mike Masefield | B52: 2 | C52: 1 | D52: =SUM(B52:C52) -> 3 | E52: 0 | F52: 0 | G52: 0 | H52: 14 | I52: 16
A53: Pat Muse | B53: 0 | C53: 1 | D53: =SUM(B53:C53) -> 1 | E53: 0 | F53: 0 | G53: 0 | H53: 2 | I53: 3
A54: Pete Puglisi | B54: 0 | C54: 0 | D54: =SUM(B54:C54) -> 0 | E54: 0 | F54: 0 | G54: 0 | H54: 2 | I54: 5
A55: Mike Hearon | B55: 0 | C55: 0 | D55: =SUM(B55:C55) -> 0 | E55: 0 | F55: 0 | G55: 0 | H55: 0 | I55: 6
A56: John Colussi | B56: 1 | C56: 0 | D56: =SUM(B56:C56) -> 1 | E56: 0 | F56: 0 | G56: 0 | H56: 2 | I56: 6
A57: Tom Scagnelli | B57: 0 | C57: 0 | D57: =SUM(B57:C57) -> 0 | E57: 0 | F57: 0 | G57: 0 | H57: 2 | I57: 15
A58: Dan Callaghan | B58: 0 | C58: 0 | D58: =SUM(B58:C58) -> 0 | E58: 0 | F58: 0 | G58: 0 | H58: 0 | I58: 1
A59: Bench | B59: 0 | C59: 0 | D59: =SUM(B59:C59) -> 0 | E59: 0 | F59: 0 | G59: 0 | H59: 2 | I59: 15
A60: Joe Wichowski | B60: 0 | C60: 0 | D60: =SUM(B60:C60) -> 0 | E60: 0 | F60: 0 | G60: 0 | H60: 0 | I60: 15
A61: Greg Siroky | B61: 0 | C61: 0 | D61: =SUM(B61:C61) -> 0 | E61: 0 | F61: 0 | G61: 0 | H61: 0 | I61: 1
A62: FORDHAM | B62: =SUM(B35:B61) -> 91 | C62: =SUM(C35:C61) -> 107 | D62: =SUM(D35:D61) -> 198 | E62: =SUM(E35:E61) -> 17 | F62: =SUM(F35:F61) -> 4 | G62: =SUM(G35:G61) -> 14 | H62: =SUM(H35:H61) -> 228 | I62: 16
A63: OPPONENT | B63: 30 | C63: 41 | D63: 71 | E63: 7 | F63: 3 | G63: 2 | H63: 227 | I63: 16
A65: TOTAL NON-LEAGUE/PLAYOFFS
A66: PLAYER | B66: G | C66: A | D66: PTS | E66: PP | F66: SH | G66: GW | H66: PIM | I66: GP
A67: Jorge Rocha | B67: 8 | C67: 9 | D67: =SUM(B67:C67) -> 17 | E67: 1 | F67: 0 | G67: 1 | H67: 26 | I67: 9
A68: Matt Pangia | B68: 10 | C68: 2 | D68: =SUM(B68:C68) -> 12 | E68: 3 | F68: 0 | G68: 0 | H68: 0 | I68: 8
A69: Stephen Barrett | B69: 7 | C69: 5 | D69: =SUM(B69:C69) -> 12 | E69: 1 | F69: 0 | G69: 3 | H69: 2 | I69: 9
A70: John Stachulski | B70: 4 | C70: 3 | D70: =SUM(B70:C70) -> 7 | E70: 0 | F70: 0 | G70: 0 | H70: 0 | I70: 3
A71: John Gibbons | B71: 5 | C71: 3 | D71: =SUM(B71:C71) -> 8 | E71: 1 | F71: 0 | G71: 1 | H71: 10 | I71: 9
A72: Dave Improta | B72: 3 | C72: 6 | D72: =SUM(B72:C72) -> 9 | E72: 1 | F72: 1 | G72: 1 | H72: 8 | I72: 8
A73: Jim Bertorelli | B73: 3 | C73: 4 | D73: =SUM(B73:C73) -> 7 | E73: 0 | F73: 0 | G73: 0 | H73: 16 | I73: 8
A74: John Rutter | B74: 1 | C74: 6 | D74: =SUM(B74:C74) -> 7 | E74: 1 | F74: 0 | G74: 0 | H74: 6 | I74: 9
A75: Mike Connolly | B75: 0 | C75: 6 | D75: =SUM(B75:C75) -> 6 | E75: 0 | F75: 0 | G75: 0 | H75: 6 | I75: 9
A76: Colin Downey | B76: 0 | C76: 1 | D76: =SUM(B76:C76) -> 1 | E76: 0 | F76: 0 | G76: 0 | H76: 6 | I76: 6
A77: Steve Casey | B77: 1 | C77: 0 | D77: =SUM(B77:C77) -> 1 | E77: 1 | F77: 0 | G77: 0 | H77: 4 | I77: 3
A78: Mike Winton | B78: 0 | C78: 5 | D78: =SUM(B78:C78) -> 5 | E78: 0 | F78: 0 | G78: 0 | H78: 12 | I78: 8
A79: Dan Ferraro | B79: 0 | C79: 1 | D79: =SUM(B79:C79) -> 1 | E79: 0 | F79: 0 | G79: 0 | H79: 0 | I79: 4
A80: Mike Lynch | B80: 2 | C80: 1 | D80: =SUM(B80:C80) -> 3 | E80: 0 | F80: 0 | G80: 1 | H80: 0 | I80: 4
A81: James Reilly | B81: 0 | C81: 1 | D81: =SUM(B81:C81) -> 1 | E81: 0 | F81: 0 | G81: 0 | H81: 2 | I81: 9
A82: Derek Kennedy | B82: 2 | C82: 0 | D82: =SUM(B82:C82) -> 2 | E82: 0 | F82: 0 | G82: 0 | H82: 2 | I82: 7
A83: Ian O'Reilly | B83: 0 | C83: 2 | D83: =SUM(B83:C83) -> 2 | E83: 0 | F83: 0 | G83: 0 | H83: 8 | I83: 8
A84: Mike Masefield | B84: 1 | C84: 1 | D84: =SUM(B84:C84) -> 2 | E84: 0 | F84: 0 | G84: 0 | H84: 2 | I84: 7
A85: Pat Muse | B85: 0 | C85: 3 | D85: =SUM(B85:C85) -> 3 | E85: 0 | F85: 0 | G85: 0 | H85: 2 | I85: 6
A86: Pete Puglisi | B86: 2 | C86: 0 | D86: =SUM(B86:C86) -> 2 | E86: 0 | F86: 1 | G86: 0 | H86: 0 | I86: 7
A87: Mike Hearon | B87: 0 | C87: 1 | D87: =SUM(B87:C87) -> 1 | E87: 0 | F87: 0 | G87: 0 | H87: 4 | I87: 7
A88: John Colussi | B88: 0 | C88: 0 | D88: =SUM(B88:C88) -> 0 | E88: 0 | F88: 0 | G88: 0 | H88: 0 | I88: 5
A89: Tom Scagnelli | B89: 0 | C89: 0 | D89: =SUM(B89:C89) -> 0 | E89: 0 | F89: 0 | G89: 0 | H89: 4 | I89: 9
A90: Dan Callaghan | B90: 0 | C90: 0 | D90: =SUM(B90:C90) -> 0 | E90: 0 | F90: 0 | G90: 0 | H90: 0 | I90: 6
A91: Bench | B91: 0 | C91: 0 | D91: =SUM(B91:C91) -> 0 | E91: 0 | F91: 0 | G91: 0 | H91: 2 | I91: 9
A92: Joe Wichowski | B92: 0 | C92: 0 | D92: =SUM(B92:C92) -> 0 | E92: 0 | F92: 0 | G92: 0 | H92: 0 | I92: 8
A93: Greg Siroky | B93: 0 | C93: 0 | D93: =SUM(B93:C93) -> 0 | E93: 0 | F93: 0 | G93: 0 | H93: 0 | I93: 5
A94: FORDHAM | B94: =SUM(B67:B93) -> 49 | C94: =SUM(C67:C93) -> 60 | D94: =SUM(D67:D93) -> 109 | E94: =SUM(E67:E93) -> 9 | F94: =SUM(F67:F93) -> 2 | G94: =SUM(G67:G93) -> 7 | H94: =SUM(H67:H93) -> 122 | I94: 9
A95: OPPONENT | B95: 20 | C95: 23 | D95: 43 | E95: 3 | F95: 0 | G95: 2 | H95: 92 | I95: 9