A1: TOTAL LEAGUE & NON-LEAGUE (Combined)
A2: FORDHAM | B2: 26 | C2: - | D2: 109 | E2: =(B2/D2) -> 0.23853211009174313
A3: OPPONENT | B3: 10 | C3: - | D3: 123 | E3: =(B3/D3) -> 8.1300813008130079E-2
A5: TOTAL LEAGUE
A6: FORDHAM | B6: 17 | C6: - | D6: 75 | E6: =(B6/D6) -> 0.22666666666666666
A7: OPPONENT | B7: 7 | C7: - | D7: 84 | E7: =(B7/D7) -> 8.3333333333333329E-2
A9: TOTAL NON-LEAGUE/PLAYOFFS
A10: FORDHAM | B10: 9 | C10: - | D10: 34 | E10: =(B10/D10) -> 0.26470588235294118
A11: OPPONENT | B11: 3 | C11: - | D11: 39 | E11: =(B11/D11) -> 7.6923076923076927E-2