A1: TOTAL LEAGUE & NON-LEAGUE (Combined)
A2: GAA | C2: W | D2: L | E2: T | F2: MIN | G2: GA | H2: EN | I2: SAV | J2: SHO | K2: PCT | L2: GP
A3: 3.00 | B3: DanCallaghan | C3: 2 | D3: 0 | E3: 0 | F3: 140 | G3: 7 | H3: 0 | I3: 57 | J3: 64 | K3: 0.890625 | L3: 3
A4: 3.5675675675675675 | B4: GregSiroky | C4: 2 | D4: 1 | E4: 0 | F4: 185 | G4: 11 | H4: 0 | I4: 79 | J4: 90 | K4: 0.87777777777777777 | L4: 5
A5: 3.404791929382093 | B5: JoeWichowski | C5: 9 | D5: 4 | E5: 1 | F5: 793 | G5: 45 | H5: 1 | I5: 407 | J5: 452 | K5: 0.90044247787610621 | L5: 15
A6: =60/+F6*+G6 -> 3.3810375670840784 | B6: FORDHAM | C6: =SUM(C3:C5) -> 13 | D6: =SUM(D3:D5) -> 5 | E6: =SUM(E3:E5) -> 1 | F6: 1118 | G6: =SUM(G3:G5) -> 63 | H6: =SUM(H3:H5) -> 1 | I6: =SUM(I3:I5) -> 543 | J6: =SUM(J3:J5) -> 606 | K6: =I6/+J6 -> 0.89603960396039606 | L6: 19
A7: 5.05 | B7: OPPONENT | C7: 5 | D7: 13 | E7: 1 | F7: 1117 | G7: 94 | H7: 1 | I7: 560 | J7: 654 | K7: 0.85599999999999998 | L7: 19
A9: TOTAL LEAGUE
A10: GAA | C10: W | D10: L | E10: T | F10: MIN | G10: GA | H10: EN | I10: SAV | J10: SHO | K10: PCT | L10: GP
A11: 2.00 | B11: DanCallaghan | C11: 2 | D11: 0 | E11: 0 | F11: 120 | G11: 4 | H11: 0 | I11: 45 | J11: 49 | K11: 0.91836734693877553 | L11: 2
A12: 3.1111111111111107 | B12: GregSiroky | C12: 2 | D12: 0 | E12: 0 | F12: 135 | G12: 7 | H12: 0 | I12: 54 | J12: 61 | K12: 0.88524590163934425 | L12: 3
A13: 3.5576923076923079 | B13: JoeWichowski | C13: 7 | D13: 3 | E13: 1 | F13: 624 | G13: 37 | H13: 1 | I13: 317 | J13: 354 | K13: 0.89548022598870058 | L13: 11
A14: =60/+F14*+G14 -> 3.2764505119453924 | B14: FORDHAM | C14: =SUM(C11:C13) -> 11 | D14: =SUM(D11:D13) -> 3 | E14: =SUM(E11:E13) -> 1 | F14: =SUM(F11:F13) -> 879 | G14: =SUM(G11:G13) -> 48 | H14: =SUM(H11:H13) -> 1 | I14: =SUM(I11:I13) -> 416 | J14: =SUM(J11:J13) -> 464 | K14: =I14/+J14 -> 0.89655172413793105 | L14: 15
A15: 5.13 | B15: OPPONENT | C15: 3 | D15: 11 | E15: 1 | F15: 877 | G15: 75 | H15: 1 | I15: 438 | J15: 513 | K15: 0.85399999999999998 | L15: 15
A17: TOTAL NON-LEAGUE/PLAYOFFS
A18: GAA | C18: W | D18: L | E18: T | F18: MIN | G18: GA | H18: EN | I18: SAV | J18: SHO | K18: PCT | L18: GP
A19: 9.00 | B19: DanCallaghan | C19: 0 | D19: 0 | E19: 0 | F19: 20 | G19: 3 | H19: 0 | I19: 12 | J19: 15 | K19: 0.8 | L19: 1
A20: 4.80 | B20: GregSiroky | C20: 0 | D20: 1 | E20: 0 | F20: 50 | G20: 4 | H20: 0 | I20: 25 | J20: 29 | K20: 0.86206896551724133 | L20: 2
A21: 2.8402366863905324 | B21: JoeWichowski | C21: 2 | D21: 1 | E21: 0 | F21: 169 | G21: 8 | H21: 0 | I21: 90 | J21: 98 | K21: 0.91836734693877553 | L21: 4
A22: =60/+F22*+G22 -> 3.7656903765690375 | B22: FORDHAM | C22: =SUM(C19:C21) -> 2 | D22: =SUM(D19:D21) -> 2 | E22: =SUM(E19:E21) -> 0 | F22: =SUM(F19:F21) -> 239 | G22: =SUM(G19:G21) -> 15 | H22: =SUM(H19:H21) -> 0 | I22: =SUM(I19:I21) -> 127 | J22: =SUM(J19:J21) -> 142 | K22: =I22/+J22 -> 0.89436619718309862 | L22: 4
A23: 4.75 | B23: OPPONENT | C23: 2 | D23: 2 | E23: 0 | F23: 240 | G23: 19 | H23: 0 | I23: 122 | J23: 141 | K23: 0.86499999999999999 | L23: 4