A1: TOTAL LEAGUE & NON-LEAGUE (Combined)
A2: FORDHAM | B2: 23 | C2: - | D2: 110 | E2: =(B2/D2) -> 0.20909090909090908
A3: OPPONENT | B3: 17 | C3: - | D3: 130 | E3: =(B3/D3) -> 0.13076923076923078
A5: TOTAL LEAGUE
A6: FORDHAM | B6: 21 | C6: - | D6: 82 | E6: =(B6/D6) -> 0.25609756097560976
A7: OPPONENT | B7: 13 | C7: - | D7: 95 | E7: =(B7/D7) -> 0.1368421052631579
A9: TOTAL NON-LEAGUE/PLAYOFFS
A10: FORDHAM | B10: 2 | C10: - | D10: 28 | E10: =(B10/D10) -> 7.1428571428571425E-2
A11: OPPONENT | B11: 4 | C11: - | D11: 35 | E11: =(B11/D11) -> 0.11428571428571428